<?xml version="1.0" encoding="iso-8859-1"?>
<adb xsi:schemaLocation="http://ciax.sum.naoj.org/ciax-xml/schema/adb.xsd" xmlns="http://ciax.sum.naoj.org/ciax-xml/adb" xmlns:xsi="http://www.w3.org/2001/XMLSchema-instance">
  <object id="cci" label="IR Helium Compressor Control" ref="cri">
    <comm>
      <class>bbe</class>
      <client>socat - tcp:ltc-i:4002</client>
      <server>socat - udp-l:25105,reuseaddr,fork</server>
    </comm>
    <command>
      <session id="upd" label="Update Status" ref="upd" />
      <session id="c2on" label="CAS2(S1) ON" ref="x0on" />
      <session id="c2off" label="CAS2(S1) OFF" ref="x0off" />
      <session id="c1on" label="CAS1(S2) ON" ref="x1on" />
      <session id="c1off" label="CAS1(S2) OFF" ref="x1off" />
      <session id="m2on" label="MOIRCS CR(S8) ON" ref="x2on" />
      <session id="m2off" label="MOIRCS CR(S8) OFF" ref="x2off" />
      <session id="m1on" label="MOIRCS MAIN(S9) ON" ref="x3on" />
      <session id="m1off" label="MOIRCS MAIN(S9) OFF" ref="x3off" />
      <session id="cmon" label="CAS MOIRCS/MAIN ON" ref="x0on" />
      <session id="cmoff" label="CAS MOIRCS/MAIN OFF" ref="x0off" />
      <session id="ccon" label="CAS MOIRCS/CR ON" ref="x1on" />
      <session id="ccoff" label="CAS MOIRCS/CR OFF" ref="x1off" />
      <session id="caon" label="CAS BOTH HC ON" ref="x12on" />
      <session id="caoff" label="CAS BOTH HC OFF" ref="x12off" />
      <session id="maon" label="MOIRCS BOTH ON" ref="x34on" />
      <session id="maoff" label="MOIRCS BOTH OFF" ref="x34off" />
    </command>
    <status>
      <group>
        <title ref="x0sw" symbol="off-warn">CAS2(S1)(CIAO) SWITCH</title>
        <title ref="x0dr" symbol="off-warn">CAS2(S1)(CIAO) DRIVE</title>
      </group>
      <group>
        <title ref="x0tm" symbol="alarm">CAS2(S1)(CIAO) TEMP</title>
        <title ref="x0pr" symbol="alarm">CAS2(S1)(CIAO) PRESSURE</title>
      </group>
      <group>
        <title ref="x1sw" symbol="off-warn">CAS1(S2)(MOIRCS/MAIN) SWITCH</title>
        <title ref="x1dr" symbol="off-warn">CAS1(S2)(MOIRCS/MAIN) DRIVE</title>
      </group>
      <group>
        <title ref="x1tm" symbol="alarm">CAS1(S2)(MOIRCS/MAIN) TEMP</title>
        <title ref="x1pr" symbol="alarm">CAS1(S2)(MOIRCS/MAIN) PRESSURE</title>
      </group>
      <group>
        <title ref="x2sw" symbol="off-warn">MOIRCS/CR(S8) SWITCH</title>
        <title ref="x2dr" symbol="off-warn">MOIRCS/CR(S8) DRIVE</title>
      </group>
      <group>
        <title ref="x2tm" symbol="alarm">MOIRCS/CR(S8) TEMP</title>
        <title ref="x2pr" symbol="alarm">MOIRCS/CR(S8) PRESSURE</title>
      </group>
      <group>
        <title ref="x3sw" symbol="off-warn">MOIRCS/MAIN(S9) SWITCH</title>
        <title ref="x3dr" symbol="off-warn">MOIRCS/MAIN(S9) DRIVE</title>
      </group>
      <group>
        <title ref="x3tm" symbol="alarm">MOIRCS/MAIN(S9) TEMP</title>
        <title ref="x3pr" symbol="alarm">MOIRCS/MAIN(S9) PRESSURE</title>
      </group>
    </status>
  </object>
</adb>